nombre,imagen,descripcion,pagina,tipo_piel,tipo,precio,ingredientes,beneficios,puntuacion
Amazon.com: Cure by Toyo - Exfoliante suave Aqua Gel | Piel clara ...,"https://m.media-amazon.com/images/I/514+XS55+gL._AC_UF1000,1000_QL80_.jpg",Amazon.com: Cure by Toyo - Exfoliante suave Aqua Gel | Piel clara ...,https://www.amazon.com/-/es/Cure-Toyo-Exfoliante-Limpiador-corporal/dp/B001ABLKK2,Sensible,limpiador facial,111.93 €,"Niacinamida, Agua micelar, Glicerina",Ideal para piel sensible en cuidado limpiador facial,4.9
"Amazon.com: Jabón facial de espuma suave, limpiador facial de ...","https://m.media-amazon.com/images/I/71BIj7NOS0L._AC_UF1000,1000_QL80_.jpg","Amazon.com: Jabón facial de espuma suave, limpiador facial de ...",https://www.amazon.com/-/es/limpiador-limpieza-hidratante-irritante-sensibles/dp/B0DGG6Z4F8,Sensible,limpiador facial,4.76 €,"Ácido salicílico, Agua micelar, Extracto de té verde",Ideal para piel sensible en cuidado limpiador facial,4.3
Amazon.com: iUNIK Suero de alivio de árbol de té y centella ...,"https://m.media-amazon.com/images/I/71uNFvvX77L._AC_UF1000,1000_QL80_.jpg",Amazon.com: iUNIK Suero de alivio de árbol de té y centella ...,https://www.amazon.com/-/es/centella-limpiador-espumante-pegajoso-equilibrador/dp/B0D3T92B98,Sensible,limpiador facial,32.57 €,"Glicerina, Ácido salicílico, Agua micelar",Ideal para piel sensible en cuidado limpiador facial,3.5
"Amazon.com: Eucerin Crema de noche Skin Balance, hidratante facial ...",https://m.media-amazon.com/images/I/61Qg8kNAQ3L.jpg,"Amazon.com: Eucerin Crema de noche Skin Balance, hidratante facial ...",https://www.amazon.com/-/es/hidratante-sensible-enriquecida-complejo-Tri-Balance/dp/B0B29F1JGR,Sensible,crema hidratante,141.96 €,"Aloe vera, Ácido hialurónico, Ceramidas, Manteca de karité",Ideal para piel sensible en cuidado crema hidratante,3.8
Amazon.com: ISDIN Isdinceutics Hialurónico Hidratante facial ...,"https://m.media-amazon.com/images/I/51gVLccwbGL._AC_UF1000,1000_QL80_.jpg",Amazon.com: ISDIN Isdinceutics Hialurónico Hidratante facial ...,https://www.amazon.com/-/es/Isdinceutics-Hialur%C3%B3nico-Hidratante-calmante-hialur%C3%B3nico/dp/B09ZPK9S7B,Sensible,crema hidratante,117.81 €,"Aloe vera, Ceramidas, Escualano, Ácido hialurónico",Ideal para piel sensible en cuidado crema hidratante,4.9
Amazon.com: Bioderma - Crema facial - Hydrabio - Crema hidratante ...,https://m.media-amazon.com/images/I/51x2d2eYFIL.jpg,Amazon.com: Bioderma - Crema facial - Hydrabio - Crema hidratante ...,https://www.amazon.com/-/es/Bioderma-hidratante-Proporciona-luminosidad-sensibles/dp/B01AZR98HI,Sensible,crema hidratante,73.78 €,"Manteca de karité, Escualano, Ácido hialurónico",Ideal para piel sensible en cuidado crema hidratante,4.9
"Amazon.com: Eucerin Crema de día Skin Balance, hidratante facial ...","https://m.media-amazon.com/images/I/61oC0vqORoL._AC_UF1000,1000_QL80_.jpg","Amazon.com: Eucerin Crema de día Skin Balance, hidratante facial ...",https://www.amazon.com/-/es/hidratante-sensible-enriquecida-complejo-Tri-Balance/dp/B0B29GN7QW,Sensible,crema hidratante,13.94 €,"Manteca de karité, Aloe vera",Ideal para piel sensible en cuidado crema hidratante,4.3
Amazon.com: Obagi Hydrate Luxe - Hidratante facial ultra rico - No ...,"https://m.media-amazon.com/images/I/61gi6MprKTL._AC_UF1000,1000_QL80_.jpg",Amazon.com: Obagi Hydrate Luxe - Hidratante facial ultra rico - No ...,https://www.amazon.com/-/es/Obagi-Hydrate-Luxe-comedog%C3%A9nico-biomim%C3%A9ticos/dp/B00GR835AG,Sensible,crema hidratante,14.11 €,"Ceramidas, Manteca de karité",Ideal para piel sensible en cuidado crema hidratante,4.5
Amazon.com: Kit de iniciación de máscara hidratante para el ...,https://m.media-amazon.com/images/I/71EVcAkQ+xL.jpg,Amazon.com: Kit de iniciación de máscara hidratante para el ...,https://www.amazon.com/-/es/iniciaci%C3%B3n-hidratante-sensible-mascarilla-col%C3%A1geno/dp/B0CD17TFFX,Sensible,mascarilla facial,36.19 €,"Carbón activado, Vitamina C, Pepino, Ácido láctico",Ideal para piel sensible en cuidado mascarilla facial,3.1
Amazon.com: Kit de iniciación de máscara hidratante para el ...,"https://m.media-amazon.com/images/I/71EVcAkQ+xL._AC_UF1000,1000_QL80_.jpg",Amazon.com: Kit de iniciación de máscara hidratante para el ...,https://www.amazon.com/-/es/iniciaci%C3%B3n-hidratante-sensible-mascarilla-col%C3%A1geno/dp/B0CD17TFFX,Sensible,mascarilla facial,59.31 €,"Arcilla blanca, Carbón activado, Vitamina C",Ideal para piel sensible en cuidado mascarilla facial,4.8
Amazon.com: Meleell Juego de mascarillas faciales de oro de panal ...,"https://m.media-amazon.com/images/I/91KELthJsIL._AC_UF1000,1000_QL80_.jpg",Amazon.com: Meleell Juego de mascarillas faciales de oro de panal ...,https://www.amazon.com/-/es/mascarillas-faciales-quilates-mascarilla-nutritiva/dp/B0B65QZW57,Sensible,mascarilla facial,8.42 €,"Ácido láctico, Vitamina C, Pepino",Ideal para piel sensible en cuidado mascarilla facial,3.1
Amazon.com: Meleell Juego de mascarillas faciales de oro de panal ...,https://m.media-amazon.com/images/I/91KELthJsIL.jpg,Amazon.com: Meleell Juego de mascarillas faciales de oro de panal ...,https://www.amazon.com/-/es/mascarillas-faciales-quilates-mascarilla-nutritiva/dp/B0B65QZW57,Sensible,mascarilla facial,109.55 €,"Arcilla blanca, Pepino, Ácido láctico, Carbón activado",Ideal para piel sensible en cuidado mascarilla facial,4.7
"Amazon.com: NEURADERM Mascarilla facial calmante profunda, suero ...","https://m.media-amazon.com/images/I/512YalYf90L._AC_UF1000,1000_QL80_.jpg","Amazon.com: NEURADERM Mascarilla facial calmante profunda, suero ...",https://www.amazon.com/-/es/NEURADERM-Mascarilla-calmante-profunda-hidratante/dp/B0CDPDLDS6,Sensible,mascarilla facial,91.18 €,"Pepino, Carbón activado",Ideal para piel sensible en cuidado mascarilla facial,3.9
"Amazon.com: ANAI RUI Bakuchiol - Suero facial para cara, suero ...",https://m.media-amazon.com/images/I/61ztmDnoldL.jpg,"Amazon.com: ANAI RUI Bakuchiol - Suero facial para cara, suero ...",https://www.amazon.com/-/es/ANAI-RUI-Bakuchiol-alternativo-antienvejecimiento/dp/B0CT4H55TL,Sensible,serum,139.91 €,"Vitamina C, Ácido glicólico, Ácido ferúlico",Ideal para piel sensible en cuidado serum,3.2
"Amazon.com: ANAI RUI Bakuchiol - Suero facial para cara, suero ...","https://m.media-amazon.com/images/I/61ztmDnoldL._AC_UF1000,1000_QL80_.jpg","Amazon.com: ANAI RUI Bakuchiol - Suero facial para cara, suero ...",https://www.amazon.com/-/es/ANAI-RUI-Bakuchiol-alternativo-antienvejecimiento/dp/B0CT4H55TL,Sensible,serum,111.34 €,"Niacinamida, Ácido ferúlico, Ácido glicólico",Ideal para piel sensible en cuidado serum,3.0
"Amazon.com: ANAI RUI Bakuchiol - Suero facial para cara, suero ...",https://m.media-amazon.com/images/I/41HopkGBjSL._AC_.jpg,"Amazon.com: ANAI RUI Bakuchiol - Suero facial para cara, suero ...",https://www.amazon.com/-/es/ANAI-RUI-Bakuchiol-alternativo-antienvejecimiento/dp/B0CT4H55TL,Sensible,serum,25.05 €,"Vitamina C, Niacinamida",Ideal para piel sensible en cuidado serum,4.9
Amazon.com: Kit de iniciación de máscara hidratante para el ...,"https://m.media-amazon.com/images/I/71EVcAkQ+xL._AC_UF1000,1000_QL80_.jpg",Amazon.com: Kit de iniciación de máscara hidratante para el ...,https://www.amazon.com/-/es/iniciaci%C3%B3n-hidratante-sensible-mascarilla-col%C3%A1geno/dp/B0CD17TFFX,Sensible,serum,41.87 €,"Retinol, Niacinamida, Ácido ferúlico, Vitamina C",Ideal para piel sensible en cuidado serum,3.4
Amazon.com: SUNGBOON EDITOR Crema antiarrugas de colágeno profundo ...,https://m.media-amazon.com/images/I/71ihqd5O+CL.jpg,Amazon.com: SUNGBOON EDITOR Crema antiarrugas de colágeno profundo ...,https://www.amazon.com/-/es/SUNGBOON-antiarrugas-niacinamida-Hidratante-sensibles/dp/B0CRDQPLCM,Sensible,serum,6.98 €,"Ácido glicólico, Retinol",Ideal para piel sensible en cuidado serum,3.4
Amazon.com: CeraVe Protector solar 100% mineral Spf 50 | Protector ...,https://m.media-amazon.com/images/I/61LI1Vay5dL.jpg,Amazon.com: CeraVe Protector solar 100% mineral Spf 50 | Protector ...,https://www.amazon.com/-/es/Protector-mineral-di%C3%B3xido-titanio-sensibles/dp/B07P6YLL7C,Sensible,protector solar,43.51 €,"Óxido de zinc, Dióxido de titanio",Ideal para piel sensible en cuidado protector solar,3.3
Amazon.com: Loción protector solar para piel sensible por ...,https://m.media-amazon.com/images/I/71QnX+uaQML.jpg,Amazon.com: Loción protector solar para piel sensible por ...,https://www.amazon.com/-/es/Loci%C3%B3n-protector-sensible-Neutrogena-paquete/dp/B001P97U6C,Sensible,protector solar,134.6 €,"Dióxido de titanio, Óxido de zinc, Vitamina E, Alantoína",Ideal para piel sensible en cuidado protector solar,4.4
Amazon.com: La Roche-Posay Anthelios Light Fluid Face Protector ...,"https://m.media-amazon.com/images/I/615iyGHoCHL._AC_UF1000,1000_QL80_.jpg",Amazon.com: La Roche-Posay Anthelios Light Fluid Face Protector ...,https://www.amazon.com/-/es/Roche-Posay-Anthelios-Protector-oxibenzona-comedog%C3%A9nico/dp/B002CML1XE,Sensible,protector solar,141.74 €,"Vitamina E, Alantoína, Dióxido de titanio",Ideal para piel sensible en cuidado protector solar,3.6
Amazon.com: EltaMD Protector solar facial tintado transparente UV ...,"https://m.media-amazon.com/images/I/71VU0anIBSL._AC_UF1000,1000_QL80_.jpg",Amazon.com: EltaMD Protector solar facial tintado transparente UV ...,https://www.amazon.com/-/es/Protector-transparente-protector-sensible-recomendado/dp/B00ZPWR0N8,Sensible,protector solar,122.41 €,"Dióxido de titanio, Ácido hialurónico, Óxido de zinc, Alantoína",Ideal para piel sensible en cuidado protector solar,4.0
Amazon.com: Eucerin Loción de protección solar facial mineral con ...,https://m.media-amazon.com/images/I/71Sv3HPSltL.jpg,Amazon.com: Eucerin Loción de protección solar facial mineral con ...,https://www.amazon.com/-/es/Eucerin-protecci%C3%B3n-protector-comedog%C3%A9nico-sensibles/dp/B0BF3831F6,Sensible,protector solar,34.95 €,"Vitamina E, Ácido hialurónico, Alantoína",Ideal para piel sensible en cuidado protector solar,3.2
Amazon.com: La Roche-Posay Exfoliante ultrafino para piel sensible ...,"https://m.media-amazon.com/images/I/71Ch3ssd+qL._AC_UF1000,1000_QL80_.jpg",Amazon.com: La Roche-Posay Exfoliante ultrafino para piel sensible ...,https://www.amazon.com/-/es/Roche-Posay-Exfoliante-exfoliante-part%C3%ADculas-ultrafinas/dp/B002WDKJZO,Sensible,exfoliante,121.99 €,"Jojoba, Ácido glicólico, Bambú micronizado",Ideal para piel sensible en cuidado exfoliante,3.1
Amazon.com: La Roche-Posay Exfoliante ultrafino para piel sensible ...,https://m.media-amazon.com/images/I/418J5HNB0tL._AC_.jpg,Amazon.com: La Roche-Posay Exfoliante ultrafino para piel sensible ...,https://www.amazon.com/-/es/Roche-Posay-Exfoliante-exfoliante-part%C3%ADculas-ultrafinas/dp/B002WDKJZO,Sensible,exfoliante,122.78 €,"Ácido salicílico, AHA/BHA",Ideal para piel sensible en cuidado exfoliante,3.5
"Amazon.com: Exfoliante facial suave, Dermappeal Daily por SKINN ...","https://m.media-amazon.com/images/I/61xgbYTqQZL._AC_UF1000,1000_QL80_.jpg","Amazon.com: Exfoliante facial suave, Dermappeal Daily por SKINN ...",https://www.amazon.com/-/es/Exfoliante-facial-suave-Dermappeal-Daily/dp/B0B7YKK9QX,Sensible,exfoliante,135.96 €,"Ácido salicílico, Jojoba",Ideal para piel sensible en cuidado exfoliante,3.0
Amazon.com: VLCC Exfoliante facial de papaya y albaricoque para ...,https://m.media-amazon.com/images/I/511y+6LOzKL.jpg,Amazon.com: VLCC Exfoliante facial de papaya y albaricoque para ...,https://www.amazon.com/-/es/Exfoliante-albaricoque-sensibles-limpiador-exfoliante/dp/B00HSYIKBC,Sensible,exfoliante,143.46 €,"Ácido glicólico, Ácido salicílico, Bambú micronizado",Ideal para piel sensible en cuidado exfoliante,4.2
Amazon.com: Onsen Secret Gel exfoliante exfoliante – Exfoliante ...,"https://m.media-amazon.com/images/I/71pmtQKehNL._AC_UF1000,1000_QL80_.jpg",Amazon.com: Onsen Secret Gel exfoliante exfoliante – Exfoliante ...,https://www.amazon.com/-/es/Onsen-Secret-Gel-exfoliante-blanqueador/dp/B002VI5Z5O,Sensible,exfoliante,79.91 €,"Bambú micronizado, AHA/BHA, Jojoba",Ideal para piel sensible en cuidado exfoliante,3.3
Amazon.com: Bioderma - Tónico facial Sensibio - Calmante e ...,"https://m.media-amazon.com/images/I/61eTV68zpCL._AC_UF1000,1000_QL80_.jpg",Amazon.com: Bioderma - Tónico facial Sensibio - Calmante e ...,https://www.amazon.com/-/es/Bioderma-Sensibio-Calmante-hidratante-sensibles/dp/B016PXEWMM,Sensible,tónico facial,19.57 €,"Glicerina, Hamamelis, Pepino",Ideal para piel sensible en cuidado tónico facial,3.6
Amazon.com: LOVB LOVB Tónico facial de grano de avena para piel ...,"https://m.media-amazon.com/images/I/71Vadp+AFqL._AC_UF1000,1000_QL80_.jpg",Amazon.com: LOVB LOVB Tónico facial de grano de avena para piel ...,https://www.amazon.com/-/es/sensible-hidratante-antiadherente-alcohol-coreana/dp/B0BR9NHW8P,Sensible,tónico facial,140.36 €,"Pepino, Niacinamida, Glicerina",Ideal para piel sensible en cuidado tónico facial,4.2
Amazon.com: Tónico facial de hidratación intensa con aloe vera ...,"https://m.media-amazon.com/images/I/81njtOz0KUL._AC_UF1000,1000_QL80_.jpg",Amazon.com: Tónico facial de hidratación intensa con aloe vera ...,https://www.amazon.com/-/es/T%C3%B3nico-facial-hidrataci%C3%B3n-intensa-org%C3%A1nico/dp/B0CJPHVB67,Sensible,tónico facial,35.08 €,"Hamamelis, Niacinamida, Ácido láctico",Ideal para piel sensible en cuidado tónico facial,4.5
Amazon.com: LOVB LOVB Tónico facial de grano de avena para piel ...,https://m.media-amazon.com/images/I/71Vadp+AFqL.jpg,Amazon.com: LOVB LOVB Tónico facial de grano de avena para piel ...,https://www.amazon.com/-/es/sensible-hidratante-antiadherente-alcohol-coreana/dp/B0BR9NHW8P,Sensible,tónico facial,5.4 €,"Hamamelis, Pepino",Ideal para piel sensible en cuidado tónico facial,4.5
Amazon.com: Aloderma Tónico facial calmante hecho con 91% aloe ...,"https://m.media-amazon.com/images/I/71nxJWq2r1L._AC_UF1000,1000_QL80_.jpg",Amazon.com: Aloderma Tónico facial calmante hecho con 91% aloe ...,https://www.amazon.com/-/es/Aloderma-calmante-org%C3%A1nico-alanto%C3%ADna-hialur%C3%B3nico/dp/B08WPXR2CW,Sensible,tónico facial,24.96 €,"Hamamelis, Glicerina, Pepino",Ideal para piel sensible en cuidado tónico facial,4.5
Amazon.com: Deluvia Hydrate & Glow - Aceite facial para piel seca ...,https://m.media-amazon.com/images/I/41zIWu69BrL.jpg,Amazon.com: Deluvia Hydrate & Glow - Aceite facial para piel seca ...,https://www.amazon.com/-/es/Deluvia-Hydrate-Glow-esenciales-hidratante/dp/B08B475GWB,Sensible,aceite facial,36.19 €,"Aceite de rosa mosqueta, Aceite de jojoba",Ideal para piel sensible en cuidado aceite facial,4.4
Amazon.com: Deluvia Hydrate & Glow - Aceite facial para piel seca ...,"https://m.media-amazon.com/images/I/41zIWu69BrL._AC_UF1000,1000_QL80_.jpg",Amazon.com: Deluvia Hydrate & Glow - Aceite facial para piel seca ...,https://www.amazon.com/-/es/Deluvia-Hydrate-Glow-esenciales-hidratante/dp/B08B475GWB,Sensible,aceite facial,4.34 €,"Aceite de rosa mosqueta, Vitamina E",Ideal para piel sensible en cuidado aceite facial,3.1
Amazon.com: Eve Taylor Aceite facial No. 1 Piel sensible (1.02 oz ...,"https://m.media-amazon.com/images/I/41R4Fip0uSL._AC_UF1000,1000_QL80_.jpg",Amazon.com: Eve Taylor Aceite facial No. 1 Piel sensible (1.02 oz ...,https://www.amazon.com/-/es/Taylor-Aceite-facial-Piel-sensible/dp/B000N2KJA6,Sensible,aceite facial,33.32 €,"Aceite de jojoba, Vitamina E, Aceite de argán",Ideal para piel sensible en cuidado aceite facial,4.3
Amazon.com: Aceite facial para piel sensible : Belleza y Cuidado ...,"https://m.media-amazon.com/images/I/61ksZFjRFxL._AC_UF1000,1000_QL80_.jpg",Amazon.com: Aceite facial para piel sensible : Belleza y Cuidado ...,https://www.amazon.com/-/es/Aceite-facial-para-piel-sensible/dp/B071SG1BLY,Sensible,aceite facial,101.73 €,"Vitamina E, Aceite de jojoba",Ideal para piel sensible en cuidado aceite facial,3.4
Amazon.com: HAYEJIN RiceFila - Tónico de arroz con aceite facial ...,"https://m.media-amazon.com/images/I/61Fyf6f9w2L._AC_UF1000,1000_QL80_.jpg",Amazon.com: HAYEJIN RiceFila - Tónico de arroz con aceite facial ...,https://www.amazon.com/-/es/HAYEJIN-RiceFila-coreano-hidratante-sensibles/dp/B08BG2F4B9,Sensible,aceite facial,26.75 €,"Escualano, Vitamina E",Ideal para piel sensible en cuidado aceite facial,4.0
Amazon.com: Limpiador facial La Roche-Posay Effaclar en gel ...,"https://m.media-amazon.com/images/I/61fD94+o7nL._AC_UF1000,1000_QL80_.jpg",Amazon.com: Limpiador facial La Roche-Posay Effaclar en gel ...,https://www.amazon.com/-/es/Limpiador-Roche-Posay-Effaclar-espumante-purificador/dp/B003JSEGNC,Normal,limpiador facial,139.57 €,"Ácido salicílico, Agua micelar, Niacinamida",Ideal para piel normal en cuidado limpiador facial,3.6
Amazon.com: La Roche-Posay -Toleriane Limpiador facial ...,"https://m.media-amazon.com/images/I/717F3ObzIeL._AC_UF1000,1000_QL80_.jpg",Amazon.com: La Roche-Posay -Toleriane Limpiador facial ...,https://www.amazon.com/-/es/Roche-Posay-Toleriane-Limpiador-purificador-sensible/dp/B01N34XW93,Normal,limpiador facial,87.38 €,"Ácido salicílico, Agua micelar, Glicerina",Ideal para piel normal en cuidado limpiador facial,4.9
Amazon.com: La Roche-Posay Toleraine - Set de cuidado de la piel ...,"https://m.media-amazon.com/images/I/61Rg5Lfdw6L._AC_UF1000,1000_QL80_.jpg",Amazon.com: La Roche-Posay Toleraine - Set de cuidado de la piel ...,https://www.amazon.com/-/es/Roche-Posay-Toleraine-Hidratante-reparaci%C3%B3n-hidratante/dp/B0BX1Z2VMW,Normal,limpiador facial,106.74 €,"Agua micelar, Glicerina, Niacinamida, Ácido salicílico",Ideal para piel normal en cuidado limpiador facial,3.2
Amazon.com: Obagi Nu-Derm Limpiador suave – Limpiador facial suave ...,"https://m.media-amazon.com/images/I/61AvDToUJDL._AC_UF1000,1000_QL80_.jpg",Amazon.com: Obagi Nu-Derm Limpiador suave – Limpiador facial suave ...,https://www.amazon.com/-/es/Obagi-Nu-Derm-Limpiador-suave-acumulaci%C3%B3n/dp/B07Y2L1P14,Normal,limpiador facial,121.41 €,"Glicerina, Agua micelar, Ácido salicílico",Ideal para piel normal en cuidado limpiador facial,4.5
Amazon.com: Obagi Nu-Derm - Limpiador suave que elimina las ...,"https://m.media-amazon.com/images/I/51de9-YCiWL._AC_UF1000,1000_QL80_.jpg",Amazon.com: Obagi Nu-Derm - Limpiador suave que elimina las ...,https://www.amazon.com/-/es/Obagi-Nu-Derm-Limpiador-impurezas-maquillaje/dp/B097QRTLNB,Normal,limpiador facial,50.5 €,"Agua micelar, Extracto de té verde, Niacinamida, Ácido salicílico",Ideal para piel normal en cuidado limpiador facial,3.6
Amazon.com: Bioderma - Crema facial - Hydrabio - Crema hidratante ...,https://m.media-amazon.com/images/I/51x2d2eYFIL.jpg,Amazon.com: Bioderma - Crema facial - Hydrabio - Crema hidratante ...,https://www.amazon.com/-/es/Bioderma-hidratante-Proporciona-luminosidad-sensibles/dp/B01AZR98HI,Normal,crema hidratante,41.36 €,"Aloe vera, Ácido hialurónico, Escualano",Ideal para piel normal en cuidado crema hidratante,3.7
Amazon.com: Florencia Crema hidratante ligera de salvia y cítricos ...,"https://m.media-amazon.com/images/I/7121b+dWJAL._AC_UF1000,1000_QL80_.jpg",Amazon.com: Florencia Crema hidratante ligera de salvia y cítricos ...,https://www.amazon.com/-/es/Florencia-hidratante-ligera-salvia-c%C3%ADtricos/dp/B00CFX4J8E,Normal,crema hidratante,70.85 €,"Ceramidas, Aloe vera, Ácido hialurónico",Ideal para piel normal en cuidado crema hidratante,3.5
Amazon.com: Neutrogena Hydro Boost - Paquete de cuidado de la piel ...,https://m.media-amazon.com/images/I/7175O69gQGL.jpg,Amazon.com: Neutrogena Hydro Boost - Paquete de cuidado de la piel ...,https://www.amazon.com/-/es/Neutrogena-Hydro-Boost-hidratante-fragancia/dp/B0CX3D74WT,Normal,crema hidratante,119.68 €,"Escualano, Aloe vera, Ácido hialurónico, Ceramidas",Ideal para piel normal en cuidado crema hidratante,4.4
"Amazon.com: OBENCHO Crema hidratante facial para piel seca, crema ...",https://m.media-amazon.com/images/I/71E4rnBwv1L.jpg,"Amazon.com: OBENCHO Crema hidratante facial para piel seca, crema ...",https://www.amazon.com/-/es/hidratante-polipept%C3%ADdica-absorci%C3%B3n-Hidrataci%C3%B3n-Hidratante/dp/B0CQNX476S,Normal,crema hidratante,53.39 €,"Ácido hialurónico, Aloe vera, Manteca de karité",Ideal para piel normal en cuidado crema hidratante,3.1
Amazon.com: Neutrogena Hydro Boost - Paquete de cuidado de la piel ...,"https://m.media-amazon.com/images/I/7175O69gQGL._AC_UF1000,1000_QL80_.jpg",Amazon.com: Neutrogena Hydro Boost - Paquete de cuidado de la piel ...,https://www.amazon.com/-/es/Neutrogena-Hydro-Boost-hidratante-fragancia/dp/B0CX3D74WT,Normal,crema hidratante,42.18 €,"Aloe vera, Ceramidas",Ideal para piel normal en cuidado crema hidratante,4.0
"Amazon.com: 7th Heaven Coconut Cream Mask, mascarilla facial con ...","https://m.media-amazon.com/images/I/81BtvYKA0nS._AC_UF1000,1000_QL80_.jpg","Amazon.com: 7th Heaven Coconut Cream Mask, mascarilla facial con ...",https://www.amazon.com/-/es/mascarilla-hidratar-profundamente-hidratante-humectaci%C3%B3n/dp/B08RHHX56J,Normal,mascarilla facial,122.21 €,"Arcilla blanca, Carbón activado, Pepino, Vitamina C",Ideal para piel normal en cuidado mascarilla facial,3.9
"Amazon.com: 7th Heaven Coconut Cream Mask, mascarilla facial con ...",https://m.media-amazon.com/images/I/81BtvYKA0nS.jpg,"Amazon.com: 7th Heaven Coconut Cream Mask, mascarilla facial con ...",https://www.amazon.com/-/es/mascarilla-hidratar-profundamente-hidratante-humectaci%C3%B3n/dp/B08RHHX56J,Normal,mascarilla facial,112.65 €,"Carbón activado, Pepino, Vitamina C, Ácido láctico",Ideal para piel normal en cuidado mascarilla facial,3.8
Amazon.com: Freeman Mascarilla facial de gel renovador de pepino ...,"https://m.media-amazon.com/images/I/41UhZNQMJ6L._AC_UF1000,1000_QL80_.jpg",Amazon.com: Freeman Mascarilla facial de gel renovador de pepino ...,https://www.amazon.com/-/es/Mascarilla-renovador-despegable-mascarilla-rejuvenece/dp/B0D14YH5LP,Normal,mascarilla facial,51.56 €,"Vitamina C, Arcilla blanca, Pepino",Ideal para piel normal en cuidado mascarilla facial,3.4
Amazon.com: Mary Kay Mascarilla facial Botanical Effects Formula 2 ...,"https://m.media-amazon.com/images/I/61FC0oi4+aL._AC_UF1000,1000_QL80_.jpg",Amazon.com: Mary Kay Mascarilla facial Botanical Effects Formula 2 ...,https://www.amazon.com/-/es/Mascarilla-facial-Botanical-Effects-Formula/dp/B079P9YRKN,Normal,mascarilla facial,5.15 €,"Vitamina C, Pepino, Carbón activado",Ideal para piel normal en cuidado mascarilla facial,4.1
Amazon.com: New York Biology - Mascarilla facial de carbón ...,https://m.media-amazon.com/images/I/71-8X+dhzXL.jpg,Amazon.com: New York Biology - Mascarilla facial de carbón ...,https://www.amazon.com/-/es/New-York-Biology-Mascarilla-mascarilla/dp/B0B1F5S177,Normal,mascarilla facial,91.86 €,"Ácido láctico, Pepino",Ideal para piel normal en cuidado mascarilla facial,3.1
Amazon.com: The Ordinary Facial Treatment Set! Includes Vitamin C ...,"https://m.media-amazon.com/images/I/61zrbXUnMfL._AC_UF1000,1000_QL80_.jpg",Amazon.com: The Ordinary Facial Treatment Set! Includes Vitamin C ...,https://www.amazon.com/Ordinary-Treatment-Hyaluronic-Serum-Niacinamide/dp/B07X7WLCJ5,Normal,serum,51.01 €,"Retinol, Niacinamida",Ideal para piel normal en cuidado serum,3.3
Amazon.com: The Ordinary Face Serum Set! 100% Plant-Derived ...,https://m.media-amazon.com/images/I/61G-HZ57fOL.jpg,Amazon.com: The Ordinary Face Serum Set! 100% Plant-Derived ...,https://www.amazon.com/Ordinary-Serum-Plant-Derived-Niacinamide-Hyaluronic/dp/B07X8L88TR,Normal,serum,59.69 €,"Ácido glicólico, Niacinamida",Ideal para piel normal en cuidado serum,3.8
Amazon.com: JUMISO Suero facial súper calmante de cica y aloe ...,https://m.media-amazon.com/images/I/41DOz5FDidL.jpg,Amazon.com: JUMISO Suero facial súper calmante de cica y aloe ...,https://www.amazon.com/-/es/calmante-hidratante-revitalizante-cuidado-l%C3%ADquidas/dp/B08JPZ8MKX,Normal,serum,123.94 €,"Ácido glicólico, Vitamina C, Retinol",Ideal para piel normal en cuidado serum,3.1
Amazon.com: L'Oreal Paris Revitalift 1.5% Pure Hyaluronic Acid ...,https://m.media-amazon.com/images/I/71IoE52LztL.jpg,Amazon.com: L'Oreal Paris Revitalift 1.5% Pure Hyaluronic Acid ...,https://www.amazon.com/Hyaluronic-LOreal-Paris-Revitalift-Intensives/dp/B07GVCVYB9,Normal,serum,16.76 €,"Niacinamida, Ácido glicólico, Vitamina C, Retinol",Ideal para piel normal en cuidado serum,3.3
"Amazon.com: The INKEY List Beta Hydroxy Acid (BHA) Serum, Face ...","https://m.media-amazon.com/images/I/5101c3q-3lL._AC_UF1000,1000_QL80_.jpg","Amazon.com: The INKEY List Beta Hydroxy Acid (BHA) Serum, Face ...",https://www.amazon.com/INKEY-List-Hydroxy-Exfoliant-Blackheads/dp/B09PP2TR67,Normal,serum,128.17 €,"Retinol, Ácido ferúlico, Ácido glicólico",Ideal para piel normal en cuidado serum,3.7
Amazon.com: CeraVe Protector solar 100% mineral Spf 50 | Protector ...,https://m.media-amazon.com/images/I/61LI1Vay5dL.jpg,Amazon.com: CeraVe Protector solar 100% mineral Spf 50 | Protector ...,https://www.amazon.com/-/es/Protector-mineral-di%C3%B3xido-titanio-sensibles/dp/B07P6YLL7C,Normal,protector solar,76.07 €,"Dióxido de titanio, Óxido de zinc, Vitamina E",Ideal para piel normal en cuidado protector solar,4.2
Amazon.com: CeraVe Protector solar 100% mineral Spf 50 | Protector ...,"https://m.media-amazon.com/images/I/61LI1Vay5dL._AC_UF1000,1000_QL80_.jpg",Amazon.com: CeraVe Protector solar 100% mineral Spf 50 | Protector ...,https://www.amazon.com/-/es/Protector-mineral-di%C3%B3xido-titanio-sensibles/dp/B07P6YLL7C,Normal,protector solar,112.18 €,"Alantoína, Vitamina E, Óxido de zinc",Ideal para piel normal en cuidado protector solar,3.8
